url,name,address,city,state,phone
https://www.cpabr.com/,"Boyer & Ritter, LLC","ÓÉą1600 University Dr, State College, PA 16801",State College,PA,Óāį(814) 234-6919
http://www.usaccounting.com/,"U.S. Accounting & Tax Services, LLC","ÓÉą2541 E College Ave STE 105, State College, PA 16801",State College,PA,Óāį(814) 234-1099
http://www.cjwagnercpa.com/home.html,CJ Wagner CPA,"ÓÉą1423 N Atherton St, State College, PA 16803",State College,PA,Óāį(814) 954-8035
http://www.ronangroup.com/,"The Ronan Group, P.C.","ÓÉą724 S Atherton St Ste 104, State College, PA 16801",State College,PA,Óāį(814) 237-2009
http://www.odlcpas.com/,"Okonak, Dean & Lechner, PC CPA (formerly Wigfield & Associates)","ÓÉą3941 S Atherton St, State College, PA 16801",State College,PA,Óāį(814) 466-3100
http://www.happyvalleyacct.com/,"Happy Valley Accounting & Tax Services, LLC","ÓÉą270 Walker Dr Ste 116, State College, PA 16801",State College,PA,Óāį(814) 571-9552
http://www.keshvari.net/,Keshvari Accounting,"ÓÉą1402 S Atherton St, State College, PA 16801",State College,PA,Óāį(814) 308-0318
http://www.mindythomascpa.com/,Mindy M Thomas CPA PC,"ÓÉą301 Science Park Rd Suite 207, State College, PA 16803",State College,PA,Óāį(814) 237-1983
http://www.sercpa.com/,Stanton Echard & Ronan LLC,"ÓÉą724 S Atherton St C, State College, PA 16801",State College,PA,Óāį(814) 237-2009
http://www.md-cpas.com/,Maher Duessel,"ÓÉą250 E Beaver Ave STE 754, State College, PA 16801",State College,PA,Óāį(814) 308-5388
http://cpabr.com/,WILLIAM F. REHILL CPA,"ÓÉą1600 University Dr, State College, PA 16801",State College,PA,Óāį(814) 234-6919
https://pennaccountingcpa.com/,Penn Accounting CPA,"ÓÉą2000 Valley Forge Cir #127, King of Prussia, PA 19406",King of Prussia,PA,Óāį(610) 671-0000
http://www.convergepc.com/,"Converge, P.C.","ÓÉą600 Science Park Rd Suite 600-A, State College, PA 16803",State College,PA,Óāį(814) 238-5555
https://www.nittanytax.com/,"Nittany Accounting and Tax Solutions, LLC","ÓÉą2541 E College Ave STE 105, State College, PA 16801",State College,PA,Óāį(814) 400-4560
http://www.deanaccounting.com/,Dean Accounting Group PLLC,"ÓÉą1402 S Atherton St Suite 206, State College, PA 16801",State College,PA,Óāį(814) 208-4348
https://www.smeal.psu.edu/,Smeal College of Business,"ÓÉąBusiness Building, Penn State University, 210, 475 Shortlidge Rd, University Park, PA 16802",University Park,PA,
http://fultonsaccounting.com/,Fulton‚Äôs Accounting Services,"ÓÉą1515 Market St #1200, Philadelphia, PA 19102",Philadelphia,PA,Óāį(888) 538-5866
https://penntaxinstitutes.com/,pennsylvania tax institutes,"ÓÉą210 W Hamilton Ave, State College, PA 16801",State College,PA,Óāį(215) 519-3166
https://www.psu.edu/,The Pennsylvania State University,"ÓÉą201 Old Main, University Park, PA 16802",University Park,PA,Óāį(814) 865-4700
http://ffscfirm.com/about-us/,"Fiore Fedeli Snyder Carothers, LLP","ÓÉą2013 Sandy Dr #200, State College, PA 16803",State College,PA,Óāį(814) 237-8999
https://www.marshallfinancialsolutions.net/contact,Marshall Financial Solutions,"ÓÉą233 Easterly Pkwy, State College, PA 16801",State College,PA,Óāį(814) 699-9595
https://www.ritcheymock.com/,Ritchey Mock & Associates,"ÓÉą2038 Sandy Dr Suite 100A, State College, PA 16803",State College,PA,Óāį(814) 826-2155
https://www.picpa.org/,Results,"ÓÉą2001 Market St Ste 950, Philadelphia, PA 19103",Philadelphia,PA,Óāį(215) 496-9272
https://jbbandassociates.com/,Results,"ÓÉą1650 Market St Ste 3600, Philadelphia, PA 19103",Philadelphia,PA,Óāį(215) 302-9222
https://www.kimlingcpa.net/,Results,"ÓÉą1010 Race St 1st Fl Suite 3, Philadelphia, PA 19107",Philadelphia,PA,Óāį(215) 922-2684
https://wm-cpa.com/?utm_source=gmb&utm_medium=localseo&utm_content=websiteclicks,Results,"ÓÉą1515 Market St Suite 1710, Philadelphia, PA 19102",Philadelphia,PA,Óāį(215) 675-8364
http://www.sltaxadvisory.com/,Results,,University Park,PA,Óāį(215) 500-7078
https://www.buccicpafirm.com/,Results,,University Park,PA,Óāį(267) 884-4854
https://emccpas.com/,Results,"ÓÉą221 W Philadelphia St Suite 201, York, PA 17401",York,PA,Óāį(717) 650-6225
https://www.preciseservicespa.com/,Results,,University Park,PA,Óāį(267) 257-9421
http://www.holsinger.cpa/,Results,"ÓÉą117 VIP Drive #220, Wexford, PA 15090",Wexford,PA,Óāį(724) 934-4880
http://www.protaxinc.com/,Results,"ÓÉą1 State Rd Suite 103, Media, PA 19063",Media,PA,Óāį(610) 566-1165
http://www.rosscpa.com/,Results,"ÓÉą10 Hearthstone Ct, Reading, PA 19606",Reading,PA,Óāį(610) 779-9555
http://collegehilltaxprep.com/,Results,"ÓÉą621 Ann St lower front, Stroudsburg, PA 18360",Stroudsburg,PA,Óāį(570) 421-6401
https://www.pa-tax.com/,Results,"ÓÉą1431 E Grand Ave, Tower City, PA 17980",Tower City,PA,Óāį(717) 647-9862
https://www.pa.gov/en/agencies/dos/department-and-offices/bpoa/boards-commissions/accountancy-board.html,Results,"ÓÉą2525 N 7th St, Harrisburg, PA 17110",Harrisburg,PA,Óāį(833) 367-2762
http://www.pstap.org/,Results,"ÓÉą150 Corporate Center Dr Suite 205, Camp Hill, PA 17011",Camp Hill,PA,Óāį(800) 270-3352
http://www.youngcpa.net/,Results,,University Park,PA,Óāį(610) 368-3230
https://sites.google.com/uhligcpa.com/william-uhlig-cpa/home,Results,,University Park,PA,Óāį(973) 968-4544
http://www.theamericancollege.edu/,Results,"ÓÉą630 Allendale Rd #400, King of Prussia, PA 19406",King of Prussia,PA,Óāį(610) 526-1000
https://nemraccpa.com/,Results,,University Park,PA,
http://www.ttaxllc.com/,Results,,University Park,PA,Óāį(908) 917-5189
https://accounting.wharton.upenn.edu/,Results,"ÓÉą1300, 3620 Locust Walk, Philadelphia, PA 19104",Philadelphia,PA,Óāį(215) 898-7772
https://www.design.upenn.edu/cpas/home,Results,"ÓÉąMeyerson Hall, 210 S 34th St, Philadelphia, PA 19104",Philadelphia,PA,
https://www.mattickcpa.com/,Results,,University Park,PA,Óāį(607) 296-0996
http://abington.psu.edu/,Results,"ÓÉą1600 Woodland Rd, Abington, PA 19001",Abington,PA,Óāį(215) 881-7300
https://hhd.psu.edu/rptm,Results,"ÓÉą801 Ford Building, University Park, PA 16802",University Park,PA,Óāį(814) 865-1851
http://trueupsolutions.com/,Results,,University Park,PA,Óāį(215) 693-2019
https://kbstaxandaccounting.com/,Results,,University Park,PA,Óāį(215) 839-0100
http://www.gradschool.psu.edu/,Results,"ÓÉą114 Kern Bldg, University Park, PA 16802",University Park,PA,Óāį(814) 865-1795
https://www.amroazazi.com/,Results,,University Park,PA,Óāį(267) 333-3779
http://www.katz.business.pitt.edu/,Results,"ÓÉą3950 Roberto Clemente Dr, Pittsburgh, PA 15260",Pittsburgh,PA,Óāį(412) 648-1700
http://www.irstaxhelpnow.com/,Results,"ÓÉą1674 Silver Birch Rd, Huntingdon Valley, PA 19006",Huntingdon Valley,PA,Óāį(215) 852-3294
http://www.barricktax.com/,Results,"ÓÉą479 Frazer Rd, Aspers, PA 17304",Aspers,PA,Óāį(717) 357-2472
http://www.jmstaxsolutions.com/,Results,"ÓÉą1700 Market St #1005, Philadelphia, PA 19103",Philadelphia,PA,Óāį(215) 778-0978
http://feddirecttax.feddir.net/,Results,"ÓÉą2225 State Rd, Drexel Hill, PA 19026",Drexel Hill,PA,Óāį(484) 635-2008
https://office.jacksonhewitt.com/tax-preparation-services-locations/en/pa/state-college/1321-north-atherton-street/10231?utm_source=google&utm_medium=local&utm_campaign=local&utm_content=10231,Results,"ÓÉą1321 N Atherton St Suite 1, State College, PA 16803",State College,PA,Óāį(814) 231-3287
http://www.philadelphiataxpreparationservice.com/,Results,"ÓÉą1500 Market St, Philadelphia, PA 19102",Philadelphia,PA,Óāį(215) 554-6123
https://www.unitaxsol.com/,Results,"ÓÉą2895 Hamilton Blvd STE 207, Allentown, PA 18104",Allentown,PA,Óāį(484) 274-6782
https://www.jdtaxaccounting.com/,Results,"ÓÉą21 S 11th St floor 2, Philadelphia, PA 19107",Philadelphia,PA,Óāį(215) 327-2042
http://strongtowerpa.com/,Results,"ÓÉą901 University Dr #1, State College, PA 16801",State College,PA,Óāį(814) 325-9806
http://www.americanaccountingtaxservices.com/,Results,"ÓÉą1028 Washington Ave, Philadelphia, PA 19147",Philadelphia,PA,Óāį(267) 761-9191
http://www.abaccountingcpa.com/,Results,"ÓÉą126 Mathews St #2400, Greensburg, PA 15601",Greensburg,PA,Óāį(724) 832-2244
http://www.ledgersbyliisa.com/,Results,,University Park,PA,Óāį(269) 397-4328
https://turbotax.intuit.com/local-tax-offices/pa/williamsport/b7c374359e314e8da496facb2c8e5f7d/,Results,"ÓÉą1000 Commerce Park Dr Office 506 Ab, Williamsport, PA 17701",Williamsport,PA,Óāį(215) 857-2052
http://jppartnersllc.com/,Results,"ÓÉą3801 W Germantown Pike Suite 206, Collegeville, PA 19426",Collegeville,PA,Óāį(484) 902-8611
https://www.beacontaxpa.com/,Results,"ÓÉą111 Mulberry Ln, Spring Mills, PA 16875",Spring Mills,PA,Óāį(814) 933-2620
https://www.hrblock.com/tax-pros/37873/,Results,"ÓÉą153 Levittown Pkwy Space #2, Levittown, PA 19055",Levittown,PA,Óāį(215) 946-1495
https://taxpa.com/,Results,"ÓÉą11502 Bustleton Ave, Philadelphia, PA 19116",Philadelphia,PA,Óāį(215) 464-3100
https://www.statecollegepa.us/167/Centre-Tax-Agency-Tax-Services,Results,"ÓÉą243 S Allen St Ste 337, State College, PA 16801",State College,PA,Óāį(814) 234-7120
https://taxpa.com/https://www.slumppump.com/?utm_source=google&utm_medium=organic&utm_campaign=gbp,Results,"ÓÉą11502 Bustleton Ave, Philadelphia, PA 19116",Philadelphia,PA,Óāį(215) 464-3100
https://www.diamondtaxconsultants.com/appointment/tax-services,Results,"ÓÉą2729 Snyder Ave, Philadelphia, PA 19145",Philadelphia,PA,Óāį(888) 456-0800
http://uwacpa.com/,Results,"ÓÉą712 E Baltimore Pike, Kennett Square, PA 19348",Kennett Square,PA,Óāį(610) 444-3222
http://www.jhfunktax.com/,Results,"ÓÉą566 Chestnut St, Emmaus, PA 18049",Emmaus,PA,Óāį(610) 966-1040
https://www.ridgelinebusinesssolutions.com/,Results,,University Park,PA,Óāį(814) 400-5436
